{"$schema":"https://json-schema.org/draft/2020-12/schema","type":"object","additionalProperties":false,"required":["record_type","schema_version","visitor_id","created_at","session_family","session_type","display_name","status","last_seen","profile_path","notes"],"properties":{"record_type":{"const":"visitor"},"schema_version":{"$ref":"common.schema.json#/$defs/schema_version"},"visitor_id":{"type":"string","pattern":"^[a-z][a-z0-9-]*-[0-9]{8}-[0-9]{4}-[a-z0-9][a-z0-9-]*-[0-9]{2}$"},"created_at":{"$ref":"common.schema.json#/$defs/timestamp"},"session_family":{"type":"string","minLength":1},"session_type":{"type":"string","minLength":1},"display_name":{"type":"string","minLength":1},"status":{"enum":["registered","active","dormant","retired","superseded"]},"last_seen":{"type":["string","null"],"format":"date-time"},"profile_path":{"type":["string","null"],"pattern":"^(?!/)(?!.*(?:^|/)\\\\.\\\\.(?:/|$))[A-Za-z0-9._/-]+$"},"notes":{"type":"string"}}}