{
  "record_type": "visitor",
  "schema_version": 1,
  "visitor_id": "codex-20260902-1200-fixture-01",
  "created_at": "2026-09-02T12:00:00Z",
  "session_family": "codex",
  "session_type": "review",
  "display_name": "Fixture visitor",
  "status": "registered",
  "last_seen": null,
  "profile_path": null,
  "notes": "Valid visitor fixture."
}
